{
  "schema_version": 1,
  "id": "STOP-M0-3A-002",
  "version": 27,
  "issued_at": "2026-10-29T20:11:06Z",
  "issuer": "00 Director",
  "reason": "The first semantic classification binds MAX_DEPENDENCY_CLOSURE_BYTES and its two exact source sites under pinned semantic and evidence identities, but 688 census sites remain unclassified and coverage is explicitly incomplete. Exact resource-manifest completion, public-entrypoint integration, conservative V1 bridge disposition, and the independently accepted A-J evidence manifest remain unresolved. Release generation is blocked and no positive local-consistency result is supportable.",
  "affected_components": ["exact generated verifier closure", "semantic resource-limit classification and coverage proof", "legacy bridge disposition", "complete whole-image acceptance matrix", "public result vocabulary"],
  "evidence_refs": ["reports/H-M0-124-runtime-v2-resource-classification.v1.md", "docs/M0.3A_RUNTIME_V2_RESOURCE_CLASSIFICATION.v1.json", "schemas/m0-3a-runtime-v2-resource-classification.v1.schema.json", "docs/M0.3A_RUNTIME_V2_RESOURCE_DISCOVERY.v1.md", "docs/M0.3A_RELEASE_GENERATION_READINESS.v1.md", "tools/check_runtime_v2_release_readiness.py", "tests/test_runtime_v2_release_readiness.py", "tests/test_runtime_v2_closure.py"],
  "severity": "HIGH",
  "remediation_required": ["Classify every remaining discovered source/schema site and prove bidirectional coverage of all remaining enforcement mechanisms and descriptor/contract constraints.", "Bind every accepted resource maximum to all definitions, enforcement sites, semantic dependency closures, contract equations, units, and boundary evidence without misclassifying minima, exact values, diagnostic bounds, representation limits, or relational constraints.", "Conservatively disposition the unsupported V1 migration bridge under the retained legacy amendment without inventing unavailable preimages.", "Connect the sole public entrypoint and bind independently accepted A-J evidence before generating any closure or carrier."],
  "status": "OPEN",
  "resolution_event_ref": null
}
