{
  "schema_version": 1,
  "id": "STOP-M0-3A-002",
  "version": 17,
  "issued_at": "2026-10-29T17:12:31Z",
  "issuer": "00 Director",
  "reason": "Private NEW-genesis replay now derives exact governance block and revalidation groups, including atomic claim/review invalidation and receipt replacement, but review/routing, remediation, repository import, checkpoint/export cuts, cumulative root work, exact generated closure identity, and the complete A-J matrix remain unfinished. No positive local-consistency result is supportable.",
  "affected_components": [
    "runtime-v2 semantic whole-image reduction beyond governance and revalidation replay",
    "exact generated verifier dependency closure and pin carrier",
    "versioned legacy migration evidence carrier and projector",
    "review/routing, remediation, repository import, checkpoints, exports, and cumulative root work",
    "public local-consistency result vocabulary"
  ],
  "evidence_refs": [
    "reports/H-M0-114-governance-revalidation-replay.v1.md",
    "docs/M0.3A_GOVERNANCE_REVALIDATION_REPLAY_SLICE.v1.md",
    "src/edgelab/runtime_v2_transition.py",
    "src/edgelab/runtime_v2_group.py",
    "src/edgelab/runtime_v2_initial.py",
    "tests/test_runtime_v2_transition_workspace.py",
    "tests/test_runtime_v2_initial.py",
    "reports/H-M0-113-reclaim-retry-replay.v1.md",
    "docs/M0.3A_RUNTIME_IMAGE_CONTRACT.v1.md"
  ],
  "severity": "HIGH",
  "remediation_required": [
    "Compile review assignment, approval, rejection, remediation decision, and route groups while deriving independent reviewer identity, review and decision history, and task state without trusting supplied rows.",
    "Implement two-event remediation and variable-cardinality repository import, including end-to-end N4 governance revocation and stale-task governance paths, without accepting supplied state as transition input.",
    "Implement export and checkpoint pre-registration cuts from incrementally reduced state, including selector evolution, checkpoint copies, and cumulative root-work charging.",
    "After semantic source freeze, generate the exact closure and pin carrier, prove deterministic regeneration, obtain independent acceptance, and pass every case in the M0.3A runtime-image A-J acceptance matrix before introducing a separately versioned LOCALLY_CONSISTENT_DENY_ONLY result."
  ],
  "status": "OPEN",
  "resolution_event_ref": null
}
