{
  "schema_version": 1,
  "id": "STOP-M0-3A-002",
  "version": 37,
  "issued_at": "2026-10-30T02:16:26Z",
  "issuer": "00 Director",
  "reason": "The cumulative resource classification now binds MAX_DEPENDENCY_CLOSURE_BYTES, MAX_BLOB_BYTES, MAX_EVENT_BYTES, MAX_SCHEMA_DOCUMENT_BYTES, MAX_SCHEMA_REF_NODES, MAX_SCHEMA_REGISTRY_BYTES, MAX_BOOTSTRAP_DOCUMENT_BYTES, MAX_ARGUMENTS, _PORTABLE_PATH_MAX, and _PORTABLE_COMPONENT_MAX to twenty-eight exact source sites. Of 697 census sites, 669 remain unclassified and coverage is explicitly incomplete. Exact resource-manifest completion, public-entrypoint integration, conservative V1 bridge disposition, and the independently accepted A-J evidence manifest remain unresolved. Release generation is blocked and no positive local-consistency result is supportable.",
  "affected_components": ["exact generated verifier closure", "semantic resource-limit classification and coverage proof", "legacy bridge disposition", "complete whole-image acceptance matrix", "public result vocabulary"],
  "evidence_refs": ["reports/H-M0-134-runtime-v2-portable-component-resource-classification.v1.md", "docs/M0.3A_PORTABLE_COMPONENT_CHARACTER_LIMIT.v1.md", "docs/M0.3A_RUNTIME_V2_RESOURCE_DISCOVERY.v2.md", "docs/M0.3A_RUNTIME_V2_RESOURCE_DISCOVERY.v2.json", "schemas/m0-3a-runtime-v2-resource-discovery.v2.schema.json", "docs/M0.3A_RUNTIME_V2_RESOURCE_CLASSIFICATION.v11.json", "schemas/m0-3a-runtime-v2-resource-classification.v11.schema.json", "docs/M0.3A_RELEASE_GENERATION_READINESS.v1.md", "tools/check_runtime_v2_release_readiness.py", "tests/test_runtime_v2_portable_component_bound.py", "tests/test_runtime_v2_release_readiness.py"],
  "severity": "HIGH",
  "remediation_required": ["Classify every remaining discovered source/schema site and prove bidirectional coverage of all remaining enforcement mechanisms and descriptor/contract constraints.", "Bind every accepted resource maximum to all definitions, enforcement sites, branch-specific table bindings, source-level semantic dependencies, contract equations, units, and boundary evidence without misclassifying minima, exact values, diagnostic bounds, representation limits, or relational constraints.", "Conservatively disposition the unsupported V1 migration bridge under the retained legacy amendment without inventing unavailable preimages.", "Connect the sole public entrypoint and bind independently accepted A-J evidence before generating any closure or carrier."],
  "status": "OPEN",
  "resolution_event_ref": null
}
