{
  "schema_version": 1,
  "id": "STOP-M0-3A-002",
  "version": 7,
  "issued_at": "2026-10-29T15:02:43Z",
  "issuer": "00 Director",
  "reason": "The private NEW-genesis and INITIALIZE transaction-group slices are implemented, but all later ordinary groups, remediation, repository imports, checkpoint/export cuts, cumulative root work, exact generated closure identity, and the complete A-J acceptance matrix remain unfinished. No positive local-consistency result is supportable.",
  "affected_components": [
    "runtime-v2 semantic whole-image reduction beyond INITIALIZE",
    "exact generated verifier dependency closure and pin carrier",
    "versioned legacy migration evidence carrier and projector",
    "later ordinary event groups, remediation, repository import, checkpoints, exports, and cumulative root work",
    "public local-consistency result vocabulary"
  ],
  "evidence_refs": [
    "reports/H-M0-104-runtime-v2-initialize-group.v1.md",
    "docs/M0.3A_INITIALIZE_GROUP_SLICE.v1.md",
    "src/edgelab/runtime_v2_group.py",
    "tests/test_runtime_v2_initial.py",
    "reports/H-M0-103-runtime-v2-closure-shape.v1.md",
    "docs/M0.3A_RUNTIME_IMAGE_CONTRACT.v1.md"
  ],
  "severity": "HIGH",
  "remediation_required": [
    "Extend atomic retained-group planning, typed reachability, task-attempt chains, and exact table projection across every later single-semantic task operation.",
    "Implement and adversarially test two-event remediation and variable-cardinality repository import without accepting supplied state as transition input.",
    "Implement export and checkpoint pre-registration cuts from incrementally reduced state, including selector evolution, checkpoint copies, and cumulative root-work charging.",
    "After semantic source freeze, resolve closure-generation semantics, generate the exact closure and pin carrier, prove deterministic regeneration, and obtain independent acceptance.",
    "Pass every case in the M0.3A runtime-image A-J acceptance matrix before introducing a separately versioned LOCALLY_CONSISTENT_DENY_ONLY result."
  ],
  "status": "OPEN",
  "resolution_event_ref": null
}
