{
  "schema_version": 1,
  "id": "STOP-M0-3A-002",
  "version": 10,
  "issued_at": "2026-10-29T15:46:27Z",
  "issuer": "00 Director",
  "reason": "The private NEW-genesis, INITIALIZE, CLAIM, START, CONTINUE, and YIELD transaction-group slices are implemented, but repeated continuation, later task lifecycle groups, governance/review, remediation, repository imports, checkpoint/export cuts, cumulative root work, exact generated closure identity, and the complete A-J matrix remain unfinished. No positive local-consistency result is supportable.",
  "affected_components": [
    "runtime-v2 semantic whole-image reduction beyond one CONTINUE and YIELD",
    "exact generated verifier dependency closure and pin carrier",
    "versioned legacy migration evidence carrier and projector",
    "later ordinary event groups, remediation, repository import, checkpoints, exports, and cumulative root work",
    "public local-consistency result vocabulary"
  ],
  "evidence_refs": [
    "reports/H-M0-107-runtime-v2-continue-group.v1.md",
    "docs/M0.3A_CONTINUE_GROUP_SLICE.v1.md",
    "src/edgelab/runtime_v2_group.py",
    "tests/test_runtime_v2_initial.py",
    "reports/H-M0-106-runtime-v2-worker-groups.v1.md",
    "docs/M0.3A_RUNTIME_IMAGE_CONTRACT.v1.md"
  ],
  "severity": "HIGH",
  "remediation_required": [
    "Extend the shared worker reducer across repeated CONTINUE and every claim-closing operation while preserving exact historical claim and attempt projections.",
    "Implement governance, review, route, retry, two-event remediation, and variable-cardinality repository import without accepting supplied state as transition input.",
    "Implement export and checkpoint pre-registration cuts from incrementally reduced state, including selector evolution, checkpoint copies, and cumulative root-work charging.",
    "After semantic source freeze, generate the exact closure and pin carrier, prove deterministic regeneration, and obtain independent acceptance.",
    "Pass every case in the M0.3A runtime-image A-J acceptance matrix before introducing a separately versioned LOCALLY_CONSISTENT_DENY_ONLY result."
  ],
  "status": "OPEN",
  "resolution_event_ref": null
}
