{
  "schema_version": 1,
  "id": "STOP-M0-3A-002",
  "version": 12,
  "issued_at": "2026-10-29T16:10:39Z",
  "issuer": "00 Director",
  "reason": "The private NEW-genesis, INITIALIZE, CLAIM, START, CONTINUE, YIELD, FAIL, COMPLETE, and bounded RECOVER transaction-group slices are implemented, but retry and repeated lifecycle cycles, governance/review, remediation, repository imports, checkpoint/export cuts, cumulative root work, exact generated closure identity, and the complete A-J matrix remain unfinished. No positive local-consistency result is supportable.",
  "affected_components": [
    "runtime-v2 semantic whole-image reduction beyond bounded RECOVER paths",
    "exact generated verifier dependency closure and pin carrier",
    "versioned legacy migration evidence carrier and projector",
    "retry, repeated cycles, governance/review, remediation, repository import, checkpoints, exports, and cumulative root work",
    "public local-consistency result vocabulary"
  ],
  "evidence_refs": [
    "reports/H-M0-109-runtime-v2-recover-group.v1.md",
    "docs/M0.3A_RECOVER_GROUP_SLICE.v1.md",
    "src/edgelab/runtime_v2_group.py",
    "tests/test_runtime_v2_initial.py",
    "reports/H-M0-108-runtime-v2-fail-complete-groups.v1.md",
    "docs/M0.3A_RUNTIME_IMAGE_CONTRACT.v1.md"
  ],
  "severity": "HIGH",
  "remediation_required": [
    "Implement a bounded sequential replay cursor and dispatcher, then extend replay through RETRY, repeated CONTINUE, and repeated claim/attempt cycles while preserving exact historical claim and attempt projections.",
    "Implement governance, review, route, two-event remediation, and variable-cardinality repository import without accepting supplied state as transition input.",
    "Implement export and checkpoint pre-registration cuts from incrementally reduced state, including selector evolution, checkpoint copies, and cumulative root-work charging.",
    "After semantic source freeze, generate the exact closure and pin carrier, prove deterministic regeneration, and obtain independent acceptance.",
    "Pass every case in the M0.3A runtime-image A-J acceptance matrix before introducing a separately versioned LOCALLY_CONSISTENT_DENY_ONLY result."
  ],
  "status": "OPEN",
  "resolution_event_ref": null
}
