{
  "schema_version": 1,
  "id": "STOP-M0-3A-002",
  "version": 25,
  "issued_at": "2026-10-29T19:39:44Z",
  "issuer": "00 Director",
  "reason": "The deny-only release-readiness gate now inventories prospective runtime-v2 closure inputs, but exact resource-inventory completeness, public-entrypoint integration, conservative V1 bridge disposition, and the independently accepted A-J evidence manifest remain unresolved. Release generation is blocked and no positive local-consistency result is supportable.",
  "affected_components": ["exact generated verifier closure", "semantic resource-limit manifest", "legacy bridge disposition", "complete whole-image acceptance matrix", "public result vocabulary"],
  "evidence_refs": ["reports/H-M0-122-runtime-v2-release-readiness.v1.md", "docs/M0.3A_RELEASE_GENERATION_READINESS.v1.md", "tools/check_runtime_v2_release_readiness.py", "tests/test_runtime_v2_release_readiness.py"],
  "severity": "HIGH",
  "remediation_required": ["Compile and independently review an exact complete semantic resource-limit manifest before source freeze.", "Conservatively disposition the unsupported V1 migration bridge under the retained legacy amendment without inventing unavailable preimages.", "Connect the sole public entrypoint only after its private reducer and exact release identity are complete and reviewed.", "Bind independently accepted A-J evidence before generating any closure or carrier."],
  "status": "OPEN",
  "resolution_event_ref": null
}
